name,lat,lng
โรงเรียนวัดคณิกาผล,13.7446375,100.5099962
โรงเรียนวัดดิสานุการาม,13.74898801,100.5081007
โรงเรียนวัดบรมนิวาส,13.75173395,100.5202045
โรงเรียนวัดชัยมงคล,13.74803523,100.5233987
โรงเรียนวัดปทุมวนาราม ในพระบรมราชูปถัมภ์สมเด็จพระเทพรัตนราชสุดาฯ สยามบรมราชกุมารี,13.74660034,100.5361318
โรงเรียนวัดสระบัว,13.74764983,100.5184675
โรงเรียนสวนลุมพินี,13.73306588,100.5452439
โรงเรียนวัดดวงแข,13.7420573,100.5194763
โรงเรียนปลูกจิต,13.72849857,100.5499666
โรงเรียนวัดจักรวรรดิ์,13.74266936,100.5036772
โรงเรียนวัดปทุมคงคา,13.73701194,100.5108721
โรงเรียนวัดสัมพันธวงค์,13.73836708,100.5095215
โรงเรียนวัดหัวลำโพง,13.73191299,100.5286112
โรงเรียนวัดม่วงแค,13.72623796,100.5151396
โรงเรียนวัดมหาพฤฒาราม,13.73219196,100.5170919
โรงเรียนวัดสวนพลู,13.72199424,100.5158336
โรงเรียนวัดแก้วแจ่มฟ้า,13.73177946,100.5194933
โรงเรียนวัดประชาระบือธรรม,13.78970478,100.5251298
โรงเรียนวัดสวัสดิ์วารีสีมาราม,13.7807782,100.5156662
โรงเรียนวัดราชผาติการาม,13.78056599,100.5045852
โรงเรียนวัดเทวราชกุญชร,13.77300885,100.5016606
โรงเรียนวัดสัมณานัมบริหาร,13.75981201,100.5163079
โรงเรียนเบญจมบพิตร,13.76631526,100.5127247
โรงเรียนสุโขทัย,13.77627259,100.5221757
โรงเรียนวัดจันทร์สโมสร,13.79100395,100.5152975
โรงเรียนวัดธรรมาภิรตาราม,13.79877608,100.5330598
โรงเรียนวัดดอกไม้,13.68312552,100.5260308
โรงเรียนวัดช่องลม,13.70441601,100.5459532
โรงเรียนวัดช่องนนทรี,13.69367649,100.5446442
โรงเรียนวัดปริวาศ,13.67308296,100.5333245
โรงเรียนวัดคลองใหม่,13.67798918,100.5438578
โรงเรียนวัดคลองภูมิ,13.68077022,100.5486923
โรงเรียนวัดไผ่ตัน,13.79628523,100.5482858
โรงเรียนบ้านบัวมล,13.88084735,100.6557439
โรงเรียนประชาภิบาล,13.87304009,100.5969774
โรงเรียนบ้านคลองบัว,13.86433542,100.6407138
โรงเรียนวัดไตรรัตนาราม,13.84995927,100.6182908
โรงเรียนไขศรีปราโมชอนุสรณ์,13.76424023,100.6365179
โรงเรียนสุเหร่าคลองจั่น,13.76446016,100.6347069
โรงเรียนวัดเทพลีลา,13.75830478,100.6155041
โรงเรียนวัดศรีบุญเรือง,13.7667909,100.6525059
โรงเรียนลำสาลี (ราษฎร์บำรุง),13.74948603,100.6504889
โรงเรียนคลองกะจะ,13.74895943,100.6290975
โรงเรียนสุเหร่าวังใหญ่,13.74922689,100.6741769
โรงเรียนสุเหร่าหัวหมากน้อย,13.75829206,100.656894
โรงเรียนบ้านบางกะปิ (ประถมศึกษา),13.7719651,100.6465128
โรงเรียนวัดบึงทองหลาง,13.79510917,100.6254403
โรงเรียนบางจาก (นาคเผื่อนอุปถัมป์),13.69644485,100.5955557
โรงเรียนวัดราษฎร์ศรัทธาธรรม,13.7025169,100.6222963
โรงเรียนพูนสิน (เพชรสุขอุปถัมภ์),13.68333031,100.6037686
โรงเรียนวัดธรรมมงคล (หลวงพ่อวิริยังค์อุปถัมป์),13.68883233,100.6153153
โรงเรียนไทยนิยมสงเคราะห์,13.87736151,100.5982375
โรงเรียนมัธยมบ้านบางกะปิ,13.77177263,100.6469091
โรงเรียนมัธยมประชานิเวศน์,13.84371573,100.5465548
โรงเรียนมัธยมนาคนาวาอุปถัมภ์,13.73152041,100.6130275
โรงเรียนมัธยมสุวิทย์เสรีอนุสรณ์,13.70920385,100.6620408
โรงเรียนวัดใหม่ช่องลม,13.74914205,100.5717219
โรงเรียนมัธยมปุรณาวาส,13.80124087,100.3369944
โรงเรียนมัธยมวัดสุทธาราม,13.7130729,100.4934753
โรงเรียนคงโครัดอุทิศ,13.68201892,100.4359617
โรงเรียนเกษตรทฤษฎีใหม่ตามแนวพระราชดำริ เขตหนองจอก,13.83272965,100.841393
โรงเรียนเกษตรทฤษฎีใหม่ตามแนวพระราชดำริ เขตทวีวัฒนา,13.76086499,100.347576
โรงเรียนเกษตรทฤษฎีใหม่ตามแนวพระราชดำริ เขตสายไหม,13.89505185,100.6603785
โรงเรียนเกษตรทฤษฎีใหม่ตามแนวพระราชดำริ เขตสะพานสูง,13.75131292,100.702172
โรงเรียนอมาตยกุล,13.8676472,100.5895207
โรงเรียนอนุบาลอนงค์นาฎ,13.86322886,100.6250344
โรงเรียนอนุบาลปราโมชพัฒนา,13.85037725,100.6450931
โรงเรียนนิเวศน์วารินทร์,13.88883778,100.6083642
โรงเรียนอนุบาลโชคชัยชัยพฤกษ์,13.86899843,100.6395161
โรงเรียนจารุวรรณ,13.87872877,100.6428688
โรงเรียนสุขฤทัย,13.85032881,100.6509484
โรงเรียนอนุบาลวัชรพล,13.87261397,100.6489226
โรงเรียนปราโมชวิทยารามอินทรา,13.86959471,100.6068716
โรงเรียนปราโมชวิทยาทาน,13.85980073,100.5868307
โรงเรียนถนอมบุตร,13.76591417,100.6524997
โรงเรียนนราธิปพิทยา,13.78597938,100.6404887
โรงเรียนพร้อมมิตรพิทยา,13.77064044,100.6553442
โรงเรียนพระมารดานิจจานุเคราะห์,13.79164385,100.6395664
โรงเรียนเพ็ญสมิทธ์,13.7625017,100.6639608
โรงเรียนอนุบาลชุติมา,13.74747529,100.642985
โรงเรียนอนุบาลวรรณทิพย์ ชุมชนคลองจั่น,13.77345675,100.6478272
โรงเรียนอนุบาลวิมลทิพย์,13.75135244,100.622595
โรงเรียนอนุบาลภัทรบุตร์,13.77254873,100.636252
โรงเรียนอนุบาลบ้านทิพย์,13.75174928,100.6158475
โรงเรียนอนุบาลกรสุภา,13.75820281,100.6432263
โรงเรียนอนุบาลกาญจนาพร,13.76172074,100.6470144
โรงเรียนณัฏฐวุฒิวิทยา,13.77922817,100.6403676
โรงเรียนหัวหมากวิทยานุสรณ์,13.76369385,100.6479715
โรงเรียนอนุบาลทับแก้ว,13.7447403,100.6532388
โรงเรียนกองทัพบกอุปถัมภ์เพชราวุธวิทยา,13.86002131,100.5918372
โรงเรียนวัฒนานนท์วิทยา,13.77540363,100.6513457
โรงเรียนอัสสัมชัญคอนแวนต์,13.72326719,100.5146212
โรงเรียนอัสสัมชัญ,13.72356703,100.5158437
โรงเรียนอัสสัมชัญคอนแวนต์ สีลม,13.7219479,100.5218987
โรงเรียนอัสสัมชัญศึกษา,13.72264828,100.5153107
โรงเรียนสวนบัว,13.777763,100.5412276
โรงเรียนอนุบาลพิณทิพย์,13.77982458,100.5483253
โรงเรียนอนุบาลดรุณา,13.79248735,100.5513776
โรงเรียนพระแม่มารีสาธุประดิษฐ์,13.6938579,100.5329136
โรงเรียนสารสาสน์พัฒนา,13.69193975,100.5302848
โรงเรียนสารสาสน์พิทยา,13.69714397,100.530679
โรงเรียนอนุบาลบ้านสานฝัน,13.71541306,100.5465522
โรงเรียนเชิดเจิมศิลป์,13.7251431,100.7857828
โรงเรียนมาเรียลัย,13.72560521,100.7918603
โรงเรียนยุพลพัฒน์วัฒนา,13.75531894,100.786187
โรงเรียนอนุบาลทอฟ้า,13.73890708,100.4310366
โรงเรียนสถาพรศึกษา,13.71920066,100.4664783
โรงเรียนขจรโรจน์วิทยา แผนกอนุบาล,13.65621473,100.4994394
โรงเรียนอนุบาลยุวมิตร,13.70255322,100.3582272
โรงเรียนวีรสุนทร,13.70959145,100.3523408
โรงเรียนอนุบาลเสริมปัญญาพุดตาน,13.68868633,100.3348861
โรงเรียนวลีรัตน์วิทยา,13.72462282,100.4375335
โรงเรียนอนุบาลเบญจมาศ,13.78648779,100.5524201
โรงเรียนอนุบาลพระแม่แห่งยุติธรรม,13.6812234,100.5295869
โรงเรียนตรีวิทยา,13.69796526,100.5308878
โรงเรียนวรมงคล,13.70018288,100.5333244
โรงเรียนอนุบาลมณีรัตน์,13.70557478,100.5369743
โรงเรียนอนุบาลมะลิวัลย์,13.69027714,100.5461844
โรงเรียนซางตาครู้สคอนแวนท์,13.73722601,100.4935265
โรงเรียนอรรถญาสาธิต,13.77305707,100.7310792
โรงเรียนอนุบาลเด่นสยาม,13.77456823,100.7321168
โรงเรียนอนุบาลดารวี,13.71667317,100.4335184
โรงเรียนเซนต์ปีเตอร์ ธนบุรี,13.73715479,100.4307947
โรงเรียนผดุงกิจวิทยา,13.71963881,100.4287283
โรงเรียนเผดิมศึกษา,13.72567555,100.4660469
โรงเรียนสุจิณณ์วดี,13.72474908,100.4561012
โรงเรียนสารสาสน์สุขสวัสดิ์,13.66907258,100.4822895
โรงเรียนอนุบาลรักวิทย์,13.70196798,100.3362185
โรงเรียนรุจิเสรีวิทยา,13.78445749,100.5532945
โรงเรียนธำรงค์วิทย์,13.77660948,100.5449933
โรงเรียนอนุบาลเปล่งประสิทธิ์สายลม,13.78174176,100.5496234
โรงเรียนสารสาสน์เอกตรา,13.69607936,100.5288879
โรงเรียนเซนต์ยอแซฟยานนาวา,13.70377273,100.536038
โรงเรียนเกื้อวิทยา,13.7097717,100.4952666
โรงเรียนซางตาครู้สศึกษา,13.73899325,100.4942682
โรงเรียนดรุณวิทย์วิทยา,13.72010107,100.4867331
โรงเรียนประเวศพิทยาคาร,13.72166748,100.713755
โรงเรียนศึกษาพัฒนา,13.72456603,100.7880897
โรงเรียนพร้อม,13.72261292,100.7168776
โรงเรียนอนุบาลวังทอง,13.76097142,100.7325345
โรงเรียนอนุบาลเคหะร่มเกล้า,13.77174524,100.7338252
โรงเรียนสารสาสน์วิเทศร่มเกล้า,13.74896158,100.7437451
โรงเรียนฐานปัญญา,13.69501697,100.4345798
โรงเรียนอนุบาลบ้านสวน,13.71687643,100.4374308
โรงเรียนทองพูน,13.74583369,100.4181322
โรงเรียนเปี่ยมสุวรรณวิทยา,13.73372075,100.4614735
โรงเรียนสุธรรมศึกษา,13.73134092,100.4618841
โรงเรียนอนุบาลธีรานุรักษ์,13.73912255,100.4544792
โรงเรียนขจรโรจน์วิทยา,13.6560036,100.4984767
โรงเรียนปัญญาศักดิ์,13.67254938,100.5083247
โรงเรียนเยาวลักษณ์วิทยาธนบุรี,13.67831861,100.4945594
โรงเรียนจันทศิริวิทยา,13.68017155,100.3430755
โรงเรียนกรพิทักษ์ศึกษา,13.67985603,100.3823559
โรงเรียนพิมานวิทย์,13.75811232,100.4986248
โรงเรียนภารตวิทยาลัย,13.75049553,100.5025157
โรงเรียนราชินี,13.74269192,100.4940142
โรงเรียนสตรีวรนาถ,13.76716105,100.5045087
โรงเรียนกองทัพบกอุปถัมภ์สื่อสารสงเคร,13.79353923,100.5292058
โรงเรียนกันตะบุตร,13.78877358,100.5163837
โรงเรียนจิตรลดา,13.77244743,100.5194967
โรงเรียนช่างอากาศอำรุง,13.79708938,100.5324753
โรงเรียนเซนต์คาเบรียล,13.7758998,100.506368
โรงเรียนเซนต์ฟรังซีสซาเวียร์คอนแวนต์,13.77669084,100.5056147
โรงเรียนพันธะวัฒนา,13.77932611,100.515139
โรงเรียนโยนออฟอาร์ค,13.77807415,100.5055681
โรงเรียนราชวัตรวิทยา,13.78141214,100.5198691
โรงเรียนราชินีบน,13.78966888,100.5133836
โรงเรียนวชิราวุธวิทยาลัย,13.77538285,100.5184152
โรงเรียนศรีดรุณ,13.79058792,100.5182637
โรงเรียนอนุบาลกรแก้ว,13.78845061,100.5291264
โรงเรียนอนุบาลธรรมภิรักษ์เทเวศร์,13.77121071,100.5045068
โรงเรียนอนุบาลยุววิทย์,13.77744163,100.5070068
โรงเรียนอนุบาลสาริน,13.78836555,100.5195164
โรงเรียนอักษรเจริญ,13.7784929,100.5197948
โรงเรียนเซนต์เทเรซา,13.85258975,100.8777902
โรงเรียนวิทยปัญญา,13.87575861,100.8830088
โรงเรียนสุเหร่าคู้วิทยา,13.85188783,100.8065141
โรงเรียนหนองจอกกงลิบฮัวเคียว,13.85733757,100.8655814
โรงเรียนหนองจอกพิทยานุสสรณ์มัธยม,13.86102159,100.8541406
โรงเรียนอนุบาลธนามาศ,13.85947742,100.8646734
โรงเรียนกรุงเทพคริสเตียนวิทยาลัย,13.72070443,100.5227229
โรงเรียนไทยคริสเตียนสะพานเหลือง,13.73448592,100.5232926
โรงเรียนเซนต์โยเซฟคอนเวนต์,13.72567274,100.5349415
โรงเรียนยุหมินพัฒนา,13.72701642,100.5193794
โรงเรียนสัจจพิทยา,13.71903451,100.5164618
โรงเรียนอนุบาลจิดาภา,13.7310087,100.5184158
โรงเรียนอนุบาลชวนชื่น,13.7213886,100.5275722
โรงเรียนอนุบาลเปล่งประสิทธิ์,13.72089036,100.5189517
โรงเรียนอนุบาลหัวหมาก,13.7641015,100.6478356
โรงเรียนประเสริฐธรรมวิทยา,13.73926951,100.5215389
โรงเรียนพระมหาไถ่ศึกษา,13.73564137,100.5496806
โรงเรียนมาแตร์เดอีวิทยาลัย,13.74333833,100.5431845
โรงเรียนสีตบุตรบำรุง,13.74320381,100.5211852
โรงเรียนสุนีพิทยา,13.72655086,100.5506473
โรงเรียนอนุบาลสุนี,13.72651569,100.5504898
โรงเรียนบัณฑิตวิทยา,13.75096119,100.5150488
โรงเรียนบำรุงอิสลามวิทยา,13.75268843,100.5164008
โรงเรียนประสาทวุฒิ,13.75034025,100.5072216
โรงเรียนสมานศึกษาวิทยา,13.74775027,100.5094706
โรงเรียนอนุบาลบ้านบาตร,13.75085158,100.5063834
โรงเรียนใจรักอนุบาล,13.69428634,100.6161661
โรงเรียนบพิธวิทยา,13.69219318,100.5918569
โรงเรียนพิพัฒนา,13.6883769,100.6075191
โรงเรียนสมาหารศึกษา,13.69755794,100.6037449
โรงเรียนอนุบาลปราณี,13.6802955,100.6324695
โรงเรียนอนุบาลปาณยา,13.69995499,100.6006918
โรงเรียนอนุบาลวัฒนาสาธิต,13.68901412,100.6303295
โรงเรียนเทพอักษร,13.79839807,100.7173195
โรงเรียนมีนบุรีศึกษา,13.81068205,100.7249657
โรงเรียนมีนประสาทวิทยา,13.80907243,100.7289308
โรงเรียนสุขเนตร,13.81363104,100.7246174
โรงเรียนสุดใจวิทยา,13.8289951,100.7196618
โรงเรียนพรประสาทวิทยา,13.71992068,100.4730846
โรงเรียนมณีวิทยา,13.71800968,100.4842697
โรงเรียนศิริรักษ์วิทยา,13.70056984,100.4801846
โรงเรียนสหนิยมวิทยา,13.72379671,100.4899833
โรงเรียนสหบำรุงวิทยา,13.73049631,100.4912554
โรงเรียนแสงอรุณ,13.73816482,100.4922471
โรงเรียนอนุบาลวรรณบูรณ์ศึกษา,13.73696063,100.4940611
โรงเรียนอนุบาลแสงอรุณธนบุรี,13.73940018,100.494243
โรงเรียนอำนวยศิษย์ศึกษา,13.71357956,100.470789
โรงเรียนชัยพิทยพัฒน์ มูลนิธิชัยพัฒนา (จารุวัฒนานุกูล ท่าพระ),13.72988347,100.4834475
โรงเรียนชาตศึกษา,13.74081233,100.4804184
โรงเรียนสายประสิทธิ์วิทยา,13.7290384,100.4751295
โรงเรียนอนุบาลวรพิม,13.72939679,100.4711187
โรงเรียนดลวิทยา,13.74629485,100.5900301
โรงเรียนสิริเทพ,13.79595299,100.582005
โรงเรียนอนุบาลโชคชัย,13.77985503,100.5819058
โรงเรียนอนุบาลบุณยรักษ์,13.77675286,100.5877944
โรงเรียนอนุบาลสามภาษาบ้านต้นไม้,13.79204541,100.5838284
โรงเรียนอนุบาลวัฒนานิเวศน์,13.79300965,100.5828823
โรงเรียนอนุบาลสีชมพูมอนเทสซอริ,13.77565768,100.5767727
โรงเรียนจันทรวิทยา,13.73206888,100.5017418
โรงเรียนพัฒนาวิทยา,13.73003239,100.4962179
โรงเรียนอนุบาลเชาวน์ดี,13.71757587,100.5007157
โรงเรียนอนุบาลนันทิยา,13.71555048,100.5037818
โรงเรียนอนุบาลศันสนีย์,13.71563392,100.5064081
โรงเรียนจิตตเมตต์,13.79017747,100.4283609
โรงเรียนนิลประพันธ์,13.78030271,100.4597557
โรงเรียนวรรัตน์ศึกษา,13.79577676,100.4554585
โรงเรียนอนุบาลนกน้อย,13.74797509,100.4261442
โรงเรียนอนุบาลอภิรักษ์ชัยพฤกษ์,13.79471792,100.4647936
โรงเรียนอยู่เย็นวิทยา,13.75464982,100.4286723
โรงเรียนดิลกศึกษา,13.7677525,100.4694346
โรงเรียนเทพกาญจนา,13.75081068,100.4772909
โรงเรียนนฤมลทิน ธนบุรี,13.74792097,100.4692369
โรงเรียนบำรุงวิทยาธนบุรี,13.75179013,100.4691963
โรงเรียนมงคลวิจิตรวิทยา,13.76350491,100.4677527
โรงเรียนศุภวรรณ,13.7479386,100.4708275
โรงเรียนอนุบาลสุภัทรา,13.75350578,100.4860929
โรงเรียนอนุชนบางกอกน้อย,13.76251125,100.4857336
โรงเรียนอนุบาลจันทยานนท์,13.75178326,100.4733761
โรงเรียนอนุบาลบุษกร,13.77536822,100.4762428
โรงเรียนจารุวัฒนานุกูล,13.66074892,100.4327638
โรงเรียนรุ่งอรุณ,13.65743005,100.4654855
โรงเรียนวรรณสว่างจิต,13.65987488,100.4385268
โรงเรียนศิรินุสรณ์วิทยา,13.66518868,100.4278449
โรงเรียนสมิทธิพงษ์,13.66227042,100.4431911
โรงเรียนสุพิชญา,13.65733996,100.421937
โรงเรียนนพรัตน์พัฒนศาสตร์,13.61576922,100.403869
โรงเรียนอนุบาลสุพิชญา,13.64721302,100.422357
โรงเรียนอนุบาลเสริมวิทย์,13.6719532,100.4537979
โรงเรียนอนุบาลอภิสรา,13.65212577,100.4153057
โรงเรียนอนุบาลปัญญาศักดิ์,13.66927545,100.5056231
โรงเรียนอนุบาลเยาวมิตร,13.68021788,100.4928981
โรงเรียนอนุบาลรังสิมา,13.68973439,100.4827147
โรงเรียนอนุบาลสุพัชชา,13.67229222,100.4925709
โรงเรียนอนุบาลแสงอารีย์,13.65856058,100.5016634
โรงเรียนเขมะสิริอนุสสรณ์,13.78211597,100.4979639
โรงเรียนทิวไผ่งามและนานาชาติแคนาเดียน,13.77625071,100.4962618
โรงเรียนธรรมภิรักษ์,13.78500755,100.472687
โรงเรียนบางอ้อศึกษา,13.79611538,100.5087359
โรงเรียนบูรณวิทย์,13.78885596,100.5000046
โรงเรียนพิมลวิทย์,13.78564585,100.4942499
โรงเรียนศานติวิทยา,13.80468849,100.5081158
โรงเรียนศิริมงคลศึกษา,13.77474243,100.4960488
โรงเรียนศิริมงคลศึกษา แผนกอนุบาล,13.77729739,100.4921067
โรงเรียนสตรีบูรณวิทย์,13.78801957,100.5007854
โรงเรียนสตรีบูรณวิทย์ แผนกอนุบาล,13.78831493,100.5012683
