name,lat,lng
โรงเรียนสุเหร่าแสนแสบ,13.82564275,100.7514641
โรงเรียนวัดธาตุทอง (เรือนเขียวสะอาด),13.71966032,100.5866516
โรงเรียนสุเหร่าบ้านดอน,13.74314893,100.5802351
โรงเรียนวิจิตรวิทยา,13.74019675,100.5937246
โรงเรียนสุเหร่าบางมะเขือ (ปรีดี พนมยงค์ อนุสรณ์),13.71539995,100.5969318
โรงเรียนสุเหร่าสามอิน,13.72791473,100.5962028
โรงเรียนวัดภาษี,13.74171136,100.5887324
โรงเรียนแจ่มจันทร์,13.73916888,100.5877167
โรงเรียนสวัสดีวิทยา,13.73980307,100.5662781
โรงเรียนบางแค (เนื่องสังวาลย์อนุสรณ์),13.70728044,100.4004812
โรงเรียนวัดบุณยประดิษฐ์,13.73039836,100.3887175
โรงเรียนคลองหนองใหญ่,13.68979093,100.4175091
โรงเรียนเพชรเกษม (จตุรงค์สงครามอนุสรณ์),13.7044497,100.3846539
โรงเรียนวัดศาลาแดง,13.74932773,100.3545939
โรงเรียนบางไผ่ (บ้านนายพันแก้วขาว),13.74070986,100.4036109
โรงเรียนบางเชือกหนัง (พูนบำเพ็ญอนุสรณ์),13.75137412,100.3897196
โรงเรียนวัดพรหมสุวรรณสามัคคี,13.72966602,100.3676856
โรงเรียนบางแคเหนือ,13.71151992,100.4132197
โรงเรียนวัดม่วง,13.69360006,100.3930315
โรงเรียนวัดราษฎร์บำรุง (งามศิริวิทยาคาร),13.70145895,100.3795419
โรงเรียนหมู่บ้านเศรษฐกิจ (พุ่มประดับราษฎรสามัคคี),13.7153353,100.3746484
โรงเรียนวัดบางนาใน,13.67117006,100.6041855
โรงเรียนวัดบางนานอก,13.67624608,100.5879596
โรงเรียนผ่องพลอยอนุสรณ์,13.6614296,100.6299641
โรงเรียนรุ่งเรืองอุปถัมภ์,13.67703366,100.6115742
โรงเรียนอำนวยกนกศิริอนุสรณ์,13.67526685,100.6191514
โรงเรียนศรีเอี่ยมอนุสรณ์,13.66774694,100.6437896
โรงเรียนเพี้ยนพินอนุสรณ์,13.6644675,100.5979007
โรงเรียนบ้านนายเหรียญ,13.66887852,100.3780394
โรงเรียนบ้านนายผล (แม้นสุวรรณอุปถัมภ์),13.64326109,100.35639
โรงเรียนวัดอาวุธวิกสิตาราม,13.79035421,100.5062942
โรงเรียนวัดพระยาศิริไอยสวรรค์,13.76901957,100.4932194
โรงเรียนวัดเปาโรหิตย์,13.78017171,100.4951215
โรงเรียนวัดเทพากร (เลี่ยมมาตุทิศ),13.78648972,100.5026254
โรงเรียนวัดฉัตรแก้วจงกลณี,13.80188014,100.5135271
โรงเรียนวัดวิมุตยาราม,13.81086735,100.5146488
โรงเรียนวัดบางพลัด (ป.สุวณ.โณ),13.79259867,100.4984562
โรงเรียนวัดคฤหบดี,13.77235201,100.4967087
โรงเรียนวัดรวก,13.78131215,100.4844281
โรงเรียนวัดสามัคคีสุทธาวาส,13.79739327,100.5022882
โรงเรียนวัดไก่เตี้ย (สวัสดิ์ประชานุกูล),13.78494222,100.4654633
โรงเรียนวัดชัยพฤกษมาลา,13.79423343,100.4672139
โรงเรียนชุมทางตลิ่งชัน,13.79571884,100.4376532
โรงเรียนฉิมพลี,13.79112508,100.4129852
โรงเรียนวัดทอง (อุดมศิลปวิทยาคาร),13.77434986,100.4421745
โรงเรียนวัดมะกอก (วิสุทธิวิทยาคาร),13.77553499,100.4280592
โรงเรียนวัดโพธิ์ (ราษฎร์ผดุงผล),13.76938676,100.4267178
โรงเรียนวัดอินทราวาส,13.75921538,100.4332499
โรงเรียนวัดปากน้ำฝั่งเหนือ,13.74402202,100.4590684
โรงเรียนวัดเกาะ,13.74261969,100.4562116
โรงเรียนวัดพิกุล,13.74140014,100.4329196
โรงเรียนวัดกระโจมทอง,13.74770538,100.4429822
โรงเรียนวัดประสาท,13.75822561,100.4494646
โรงเรียนวัดรัชฎาธิฐาน,13.759051,100.4535943
โรงเรียนวัดตลิ่งชัน (ปิ่นทองสัณฐาคาร),13.77902726,100.456853
โรงเรียนวัดช่างเหล็ก,13.77413881,100.4534655
โรงเรียนวัดราชสิทธาราม,13.73579488,100.4850196
โรงเรียนวัดท่าพระ,13.73347258,100.4728085
โรงเรียนวัดประดู่ฉิมพลี,13.72411154,100.4691163
โรงเรียนวัดใหม่พิเรนทร์,13.74117183,100.4822701
โรงเรียนวัดดีดวด,13.74123452,100.4748266
โรงเรียนวัดนาคกลาง,13.74592511,100.48402
โรงเรียนบ้านนายสี,13.66379802,100.3990407
โรงเรียน วัดบางบอน (พิมพ์ จันแต้อุปถัมภ์),13.64203713,100.3800095
โรงเรียนพรหมราษฎร์รังสรรค์,13.64221957,100.3958909
โรงเรียนสถานีพรมแดน,13.62421673,100.3804976
โรงเรียนวัดนินสุขาราม,13.6742525,100.4046492
โรงเรียนพระยามนธาตุราชศรีพิจิตร์,13.66846585,100.4254426
โรงเรียนคลองต้นไทร (สุขล้อมอุทิศ),13.78350762,100.3838328
โรงเรียนคลองทวีวัฒนา (ทองน่วมอนุสรณ์),13.7555633,100.3516611
โรงเรียนคลองบางพรหม,13.76863174,100.368624
โรงเรียนคลองมหาสวัสดิ์,13.80268454,100.3523576
โรงเรียนวัดปุรณาวาส,13.80152172,100.3352201
โรงเรียนตั้งพิรุฬธรรม,13.77942393,100.3442787
โรงเรียนนาหลวง,13.64768985,100.4950504
โรงเรียนสามัคคีบำรุง,13.64571094,100.5113522
โรงเรียนบางมด (ตันเปาว์วิทยาคาร),13.65450077,100.4716699
โรงเรียนราษฎร์บูรณะ,13.63477771,100.5031583
โรงเรียนรางราชพฤกษ์ (นุชมีอุทิศ),13.63226188,100.482568
โรงเรียนวัดทุ่งครุ (พึ่งสายอนุสรณ์),13.6192304,100.5120064
โรงเรียนคลองรางจาก,13.6357197,100.5147547
โรงเรียนชูสินทองประดิษฐ์อนุสรณ์,13.65714777,100.5095486
โรงเรียนกิ่งเพชร,13.75153354,100.5263064
โรงเรียนวัดพระยายัง,13.75232872,100.5219654
โรงเรียนวัดดิสหงสาราม,13.74871696,100.5517825
โรงเรียนวัดทัศนารุณสุนทริการาม,13.76103507,100.5435223
โรงเรียนวัดประดู่ธรรมาธิปัตย์,13.80126576,100.5237158
โรงเรียนวัดบางโพโอมาวาส,13.80885645,100.5197138
โรงเรียนวัดสร้อยทอง,13.81345189,100.5176902
โรงเรียนวัดทองสุทธาราม,13.83286533,100.5298046
โรงเรียนวัดมัชฌันติการาม,13.82206886,100.5172835
โรงเรียนวัดเลียบราษฎร์บำรุง,13.82872411,100.5212857
โรงเรียนวัดประชาศรัทธาธรรม,13.81850488,100.5191474
โรงเรียนวัดดอน,13.71378875,100.5169366
โรงเรียนวัดยานนาวา,13.71770991,100.5128289
โรงเรียนวัดไผ่เงินโชตนาราม,13.70127428,100.5234667
โรงเรียนวัดราชสิงขร,13.70593924,100.5041644
โรงเรียนวัดลาดบัวขาว,13.7007931,100.4971606
โรงเรียนวัดไทร,13.69023353,100.5181815
โรงเรียนวัดจันทร์นอก,13.69012701,100.5015584
โรงเรียนวัดบางโคล่นอก,13.68729719,100.5120334
โรงเรียนวัดจันทร์ใน,13.69530153,100.5038841
โรงเรียนวัดสะพาน,13.70411035,100.5884794
โรงเรียนวัดคลองเตย,13.71011723,100.5607464
โรงเรียนศูนย์รวมน้ำใจ,13.7130348,100.5696415
โรงเรียนชุมชนหมู่บ้านพัฒนา,13.71104157,100.57463
โรงเรียนวัดตะกล่ำ,13.67665343,100.6649735
โรงเรียนแก่นทองอุปถัมภ์,13.69623226,100.6513738
โรงเรียนวัดกระทุ่มเสือปลา,13.72268009,100.6887813
โรงเรียนคลองมะขามเทศ,13.69739443,100.6761389
โรงเรียนสุเหร่าจรเข้ขบ (กุลางกรูอุปถัมภ์),13.70710812,100.6924973
โรงเรียนสุเหร่าทางควาย,13.72451941,100.6735207
โรงเรียนสุเหร่าทับช้าง,13.73354394,100.6888775
โรงเรียนสุเหร่าบึงหนองบอน,13.71364871,100.6515879
โรงเรียนสุเหร่าศาลาลอย,13.71050405,100.6676155
โรงเรียนสุเหร่าบ้านม้า,13.7357085,100.6709835
โรงเรียนคลองปักหลัก,13.68100945,100.6983561
โรงเรียนงามมานะ (แผน - ทับอุทิศ),13.71960982,100.661698
โรงเรียนคชเผือกอนุสรณ์,13.69252293,100.6800795
โรงเรียนสุวิทย์เสรีอนุสรณ์,13.70928594,100.6619304
โรงเรียนวัดดอนเมือง (ทหารอากาศอุทิศ),13.92148894,100.6010943
โรงเรียนประชาอุทิศ (จันทาบอนุสรณ์),13.92298406,100.5839295
โรงเรียนวัดเวฬุวนาราม (สินทรัพย์อนุสรณ์),13.91459361,100.5660871
โรงเรียนอยู่เป็นสุขอนุสรณ์,13.69122993,100.6383505
โรงเรียนเปรมประชา (สายหยุด-เกษมสงเคราะห์),13.94770526,100.6060504
โรงเรียนบำรุงรวิวรรณวิทยา (ทุ่งสีกัน),13.93833004,100.5828773
โรงเรียนวัดเสมียนนารี,13.84042716,100.5562833
โรงเรียนวัดเทวสุนทร,13.85389488,100.5620531
โรงเรียนบ้านลาดพร้าว,13.80456595,100.5878067
โรงเรียนรัตนโกสินทร์สมโภช (ราชทัณฑ์อุปถัมภ์),13.84691171,100.5486019
โรงเรียนเสนานิคม,13.83175178,100.5883609
โรงเรียนประชานิเวศน์(ประถมศึกษา),13.84371573,100.5465548
โรงเรียนลอยสายอนุสรณ์,13.84032033,100.6324419
โรงเรียนวัดลาดพร้าว,13.80314916,100.5902389
โรงเรียนคลองทรงกระเทียม,13.80031742,100.6128148
โรงเรียนวัดลาดปลาเค้า,13.84738668,100.6040176
โรงเรียนเทพวิทยา,13.83221421,100.5909264
โรงเรียนเพชรถนอม (คลองเสือน้อย),13.82289543,100.6157542
โรงเรียนคลองลำเจียก,13.81835969,100.634592
โรงเรียนวัดนวลจันทร์,13.81834639,100.627072
โรงเรียนวัดบางเตย,13.8033842,100.649184
โรงเรียนประภาสวิทยา,13.80417272,100.6622766
โรงเรียนวัดพิชัย,13.77303202,100.6585792
โรงเรียนคลองกุ่ม (เสรีไทย อนุสรณ์),13.78593615,100.6737353
โรงเรียนแย้มจาดวิชชานุสรณ์,13.83260276,100.6524421
โรงเรียนวัดประยุรวงค์,13.73708393,100.4945982
โรงเรียนวัดบุคคโล,13.70037629,100.4883379
โรงเรียนวัดดาวคนอง,13.69632769,100.4881552
โรงเรียนวัดกัลยาณมิตร,13.74065008,100.490848
โรงเรียนวัดขุนจันทร์,13.71984313,100.4709297
โรงเรียนวัดราชคฤห์,13.72270833,100.4800644
โรงเรียนวัดประดิษฐาราม,13.7343968,100.4875167
โรงเรียนวัดบางสะแกใน,13.71155385,100.4754825
โรงเรียนวัดเวฬุราชิณ,13.72624326,100.4860043
โรงเรียนกันตทาราราม,13.71764743,100.4783499
โรงเรียนวัดโพธินิมิตร,13.72075497,100.4847215
โรงเรียนวัดใหม่ยายนุ้ย,13.71202611,100.4690411
โรงเรียนวัดกระจับพินิจ,13.71488122,100.4859051
โรงเรียนวัดราชวรินทร์,13.70917313,100.4926001
โรงเรียนวัดใหญ่ศรีสุพรรณ,13.72901189,100.488583
โรงเรียนวัดบางน้ำชน,13.70409537,100.4907004
โรงเรียนวัดเศวตฉัตร,13.71312309,100.5060593
โรงเรียนวัดสุทธาราม,13.71310939,100.4934201
โรงเรียนวัดทองเพลง,13.72447298,100.5007133
โรงเรียนวัดทองธรรมชาติ,13.73401987,100.5064423
โรงเรียนวัดทองนพคุณ,13.73312229,100.5083598
โรงเรียนวัดพิชัยญาติ,13.73274733,100.4971968
โรงเรียนวัดสุวรรณ,13.7241964,100.5104941
โรงเรียนวัดนิมมานรดี,13.70932668,100.426789
โรงเรียนวัดจันทร์ประดิษฐาราม,13.72105367,100.4403781
โรงเรียนวัดอ่างแก้ว (จีบ ปานขำ),13.7161879,100.4531451
โรงเรียนวัดชัยฉิมพลี,13.73422022,100.4333383
โรงเรียนวัดโคนอน,13.71282704,100.4543634
โรงเรียนวัดมะพร้าวเตี้ย,13.7439503,100.4202478
โรงเรียนวัดโตนด,13.73630274,100.4528529
โรงเรียนวัดตะล่อม,13.74141609,100.4286105
โรงเรียนวัดกำแพง (เหรียญ ล้อมมานะนุกูล),13.73937277,100.4457423
โรงเรียนวัดทองศาลางาม,13.72861682,100.4639477
โรงเรียนวัดวิจิตรการนิมิตร,13.73992939,100.4602082
โรงเรียนวัดประดู่ (พ่วงอุทิศ),13.72233189,100.4567151
โรงเรียนบางจาก (โกมลประเสริฐอุทิศ),13.72688468,100.4464887
โรงเรียนวัดบางสะแกนอก,13.71582035,100.4755092
โรงเรียนวัดหัวกระบือ,13.61991959,100.449385
โรงเรียนราชมนตรี (ปลื้ม - เชื่อมนุกูล),13.64114259,100.4357512
โรงเรียนหมู่บ้านเกาะโพธิ์,13.57808724,100.3900258
โรงเรียนวัดแสมดำ,13.59089998,100.3862098
โรงเรียนคลองพิทยาลงกรณ์,13.52767342,100.420277
โรงเรียนวัดกำแพง,13.67898425,100.4463806
โรงเรียนศาลเจ้า (ห้าวนุกูลวิทยา),13.66406301,100.4270986
โรงเรียนวัดท่าข้าม,13.65222149,100.4472988
โรงเรียนวัดกก,13.67370586,100.4493436
โรงเรียนวัดบัวผัน,13.61218295,100.476833
โรงเรียนวัดประชาบำรุง,13.56936312,100.4411308
โรงเรียนวัดเลา (คณะศิษย์เทพสิทธิอุทิศ),13.66611555,100.4472819
โรงเรียนบางขุนเทียนศึกษา,13.64704525,100.4248148
โรงเรียนวัดมงคลวราราม,13.69572589,100.4799787
โรงเรียนวัดนางนอง (พิพัฒน์),13.70317137,100.4668411
โรงเรียนวัดศาลาครืน,13.70638092,100.4606479
โรงเรียนวัดโพธิ์ทอง (ขวัญโรจน์ราษฏ์รังสฤษฏ์),13.6684042,100.477654
โรงเรียนวัดสีสุก,13.67895225,100.4641394
โรงเรียนวัดบางประทุนนอก,13.69485609,100.459005
โรงเรียนวัดโพธิ์แก้ว,13.68361121,100.4878072
โรงเรียนวัดนาคนิมิตร,13.68821681,100.4795157
โรงเรียนวัดบางขุนเทียนนอก (ศิลปเดชศึกษาคาร),13.69679032,100.4651651
โรงเรียนวัดยายร่ม (วัฒนราษฎร์รังสรรค์),13.67461018,100.464658
โรงเรียนวัดไทร (ถาวรพรหมานุกูล),13.69103394,100.4556624
โรงเรียนวัดบางขุนนนท์,13.76705902,100.4690049
โรงเรียนวัดวิเศษการ,13.75693564,100.4824433
โรงเรียนวัดเจ้าอาม,13.77579781,100.4648606
โรงเรียนวัดโพธิ์เรียง,13.74433455,100.4718869
โรงเรียนวัดยางสุทธาราม,13.75393077,100.4740276
โรงเรียนวัดศรีสุดาราม,13.76681194,100.4725361
โรงเรียนวัดบางเสาธง,13.74318557,100.4674966
โรงเรียนวัดสุวรรณาราม,13.76211683,100.477667
โรงเรียนวัดพระยาทำ,13.74836929,100.4834343
โรงเรียนวัดมะลิ,13.76221886,100.460559
โรงเรียนวัดดงมูลเหล็ก,13.75144574,100.4753992
โรงเรียนวัดอัมพวา,13.74861449,100.4757143
โรงเรียนวัดสุวรรณคีรี,13.78083126,100.4681568
โรงเรียนวัดดุสิตาราม,13.76404812,100.4872045
โรงเรียนวัดปฐมบุตรอิศราราม,13.77328645,100.4766921
โรงเรียนพหลโยธิน (พ่วงเจริญอุปถัมภ์),13.94951409,100.6154473
โรงเรียนพิชัยพัฒนา,13.77332622,100.6565005
โรงเรียนวัดสะแกงาม,13.63381506,100.4193745
โรงเรียนแก้วขำทับอุปถัมภ์,13.59327129,100.4492598
โรงเรียนวัดบางกระดี่,13.59913844,100.4050186
โรงเรียนบางยี่ขันวิทยาคม,13.77551735,100.4904954
โรงเรียนวัดแสนสุข,13.81948412,100.7417991
โรงเรียนมีนบุรี,13.81299657,100.7312904
โรงเรียนคลองสองต้นนุ่น,13.79216885,100.7355758
โรงเรียนคลองสาม,13.79222196,100.7510296
โรงเรียนวังเล็กวิทยานุสรณ์ (คลองสี่),13.80329134,100.7703117
โรงเรียนบึงขวาง (มหาดไทยอุปถัมภ์),13.80305888,100.7573716
โรงเรียนสุเหร่าบางชัน,13.8040007,100.7019154
โรงเรียนวัดบำเพ็ญเหนือ,13.80001528,100.7083419
โรงเรียนสุเหร่าทรายกองดิน,13.83442494,100.7732663
โรงเรียนศาลาคู้,13.84520796,100.7955477
โรงเรียนบ้านเกาะ,13.822517,100.78138
โรงเรียนวัดทองสัมฤทธิ์,13.80093998,100.7867372
โรงเรียนวัดลาดกระบัง,13.72699102,100.752412
โรงเรียนวัดปลูกศรัทธา,13.72732083,100.7682702
โรงเรียนวัดสังฆราชา,13.7263627,100.7377256
โรงเรียนวัดบำรุงรื่น,13.74263055,100.755792
โรงเรียนวัดพลมานีย์,13.72308345,100.7980908
โรงเรียนวัดสุทธาโภชน์,13.7402482,100.7954479
โรงเรียนแสงหิรัญวิทยา,13.7127977,100.8129702
โรงเรียนวัดบึงบัว,13.76518536,100.7766546
โรงเรียนวัดทิพพาวาส,13.78047002,100.8013864
โรงเรียนลำพะอง (ราษฎร์จำเริญบุำรุง),13.77330392,100.8123076
โรงเรียนวัดราชโกษา,13.69962587,100.8512315
โรงเรียนประสานสามัคคี (บ้านทับยาว),13.73183849,100.8377642
โรงเรียนวัดขุมทอง,13.72206513,100.851509
โรงเรียนตำบลขุมทอง (ประชาอุทิศ),13.75484876,100.8571292
โรงเรียนขุมทอง (เพชรทองคำอุปถัมภ์),13.74165046,100.8527075
โรงเรียนวัดลานบุญ,13.72544709,100.7200417
โรงเรียนวัดปากบึง,13.77683958,100.7381443
โรงเรียนสุเหร่าลำนายโส,13.77546331,100.7243556
โรงเรียนแดงเป้า (สิงสุขบูรณะ),13.74823934,100.7243503
โรงเรียนเคหะชุมชนลาดกระบัง,13.76573153,100.730415
โรงเรียนประชาราษฎร์บำเพ็ญ,13.77577626,100.5836447
โรงเรียนพระราม ๙ กาญจนาภิเษก,13.75953554,100.5930694
โรงเรียนวัดใหม่ลำนกแขวก,13.80784996,100.8070807
โรงเรียนวัดมกุฎกษัตริยาราม,13.76533809,100.5069755
โรงเรียนวัดตรีทศเทพ,13.76148278,100.5032794
โรงเรียนวัดราชนัดดา,13.75545013,100.5038327
โรงเรียนวัดมหรรณพาราม,13.75414209,100.4989417
โรงเรียนวัดสุทัศน์,13.74894802,100.5013222
โรงเรียนวัดมหาธาตุ,13.75566314,100.491091
โรงเรียนวัดพระเชตุพน,13.74627121,100.4925758
โรงเรียนราชบพิธ,13.74976285,100.4996259
โรงเรียนวัดราชบูรณะ,13.74292067,100.4995176
โรงเรียนวัดอินทรวิหาร,13.76684925,100.5022779
โรงเรียนวัดพระพิเรนทร์,13.74758397,100.5056227
โรงเรียนวัดสิตาราม,13.75520441,100.5100177
